{"schemaVersion":"CapabilityGates 0.1","id":"continuation-state","policy":"experimental","gates":{"backlog":[{"id":"cas-mutation","test":"prove stale/concurrent continuation transition cannot overwrite authority and readback matches applied state"},{"id":"global-authority","test":"prove live continuation state is stored on and observable from a dedicated Git authority independent of worker checkout"},{"id":"maintenance-handoff","test":"prove Maintenance Inspect emits HANDOFF only from explicit remote continuation state and emits no phantom handoff when authority is empty"},{"id":"rollback","test":"prove canonical GitOps and Maintenance Inspect remain operational when Continuation State capability is disabled/unavailable"}],"next":["cas-mutation","global-authority","maintenance-handoff","rollback"]},"roundsWithoutActiveGates":0,"maxRoundsWithoutActiveGates":3,"deferReason":null}
